,tweet
885,zero covid doesnt work zero covid inhumane u recorded death china recorded death u population
886,easyjet cancel flight staff covidpeople cant get away covid really hasnt gone awaymadnes
887,thank hm covid rat provided state govt education prepared gp
888,covid test done sushant prior autopsy done disha died within day
889,stop researching covid pandemic isnt people covid year scientist please figure something sound like misery
890,course fantastic vip jung kook jhope literally recovered covid nick
891,probably also explains new zealands much lower incidence covid
892,delighted finally recognised covid classic symptom reminder
893,opinion american medicaid could soon lose health insurance new york timestotally normal country
894,course fantastic vip jung kook jhope literally recovered covid nick
895,nier replicant remaster wa year ago covid lockdown felt like year memory
896,premier cmoh knowingly understated risk exposure undermined usefulness covid
897,despite everything right ive got covid first mild infection start already ruined l
898,see exact sht went last year grammys people
899,cdc nih prioritized studying vax complication j peds study found kid pres w myocarditis
900,listened already knew covid wa
901,poor covid
902,country world uk usa cutting edge medicine technology badly
903,um opec set oil price oil company price gouging u well covid screwed supply chainsnow saying
904,start covid official smart people warned u big risk wa society shared resolve take coll
905,racism death u die rather addressing deserve die african c
906,trend uk greater scrutiny perps instead victim uk justice system outcome use online technology covid
907,like people want government arent going take sort step need achieve covid zero even new zealand ha dropped one supposed voluntarily stay lockdown country isnt
908,news medicare begin cover overthecounter rapid test beneficiary traditional medicar
909,stop using term wave come covid wave never ended stopped reporting number
910,covid nine new symptom added official list definitely worth reading
911,man germany get covid shot sell forged pass
912,agree maybe restriction covid went far crazy talk
913,justice vaccination staff covid warrior delhi
914,really edit covid germ v wa vibing peach meaning
915,dont know revealed robinson gave full squad covid using g
916,todays free market unless company doe something dislikessmaller local govt except mask c
917,last week urged nicola sturgeon trust scottish public keep safe covid yeste
918,partygate reesmogg insists johnson didnt mislead mp blame inhuman covid rule http
919,meeting covidsafe place sangels
920,free covid testingmonday april pmgoodwill robinson urbano way pittsburgh pa
921,long covid ha ruined life wa got ill im wa sport science major loved powerliftin
922,govt ha time meet angandwadi worker protest salary revision served delhi dur
923,triple vaccinated ontarians catching covid greater rate double vaccinated vaccinated al
924,stop pushing covid flu
925,china reportedly order mass killing pet belonging covid patient
926,yooo passed covid test took long enough kept failing
927,worked telehealth shift today patient young vaccinated healthy w covid requesting paxlov
928,course fantastic vip jung kook jhope literally recovered covid nick
929,testing available yet symptom added still april st covid nine new symptom added
930,family please keep child home feeling well monitor covid symptom lets stay health
931,unvaccinated person doesnt covid ha pcr test travel yet vaccinated person ha covid
932,first covid collective responsibility bend curve together okay actually thats dra
933,theyre going kick covid fear heading summer arent
934,east african community law journal call paperscovid east african community overcoming challenge
935,mimi got covid day filmed icsyv jiho wa next whispering everything night felt h
936,doctor threatened licensing board speak covid policy u nurse matter keeping job deny stay silent willing loose livelihood speak raise alarm
937,addendum going add particularly noteworthy information come hand piece contains quote nurs
938,dragon napoleon china asleep   wake world tremble need take headonchinas scare mongering versus reality dengue million case month
939,zero covid doesnt work zero covid inhumane u recorded death china recorded death u population
940,long covid ha ruined life wa got ill im wa sport science major loved powerliftin
941,covids combination easily transmitted deadliness combine make bad thats trouble last couple yearsother virus tend combination developed effective vaccine
942,highly inappropriate mock cause covid childish making kind joke asian
943,upsetting news covid damage lung thyroid cause issue heart rate ha
944,meanwhile shanghai empty million citizen lockdown risk covid real tale tw
945,bipartisan senate deal billion covid aid expected announced soon today per multiple source
946,unvaccinated person doesnt covid ha pcr test travel yet vaccinated person ha covid
947,long going wear mask ill wear one covid risk subsideit easy take maskit hard
948,course fantastic vip jung kook jhope literally recovered covid nick
949,zoe researcher desperate month government advertise change covid symptom understand happen defunded study currently continues collect data
950,er even though really didnt want go dr told wont let wait outside despite highrisk f
951,ha recast covid reflexively appealing prepandemic norm dismiss new concern hyst
952,also big salute jungkook hobi give mindblowing performance right recovery covid mean already suffered rona two time know tough post covid time get yet performed like nothing
953,caught covid developed brain bleed within month people told avoid place lost life didnt catch could possibly passed around fortunately nobody else caught
954,feel responsible opinion jolly good welcome debate love learn everyone like move forget everything memory like goldfish post covid
955,warning released today direct quote newest variant coronavirus doe lead severe symptom
956,anyone else still masking handwashing covidfree
957,doe everyone start question many know fully jibbed
958,course fantastic vip jung kook jhope literally recovered covid nick
959,last week began allowing mask flight today theyve cancelled flight due wait
960,ace covid susceptibility severity
961,zero covid doesnt work zero covid inhumane u recorded death china recorded death u population
962,bn population earth people die covid calm hysteric
963,fuck omicron xe shouldve taken covid seriously many u lazy
964,something celebrate covid mortality reaching historical low globally
965,great graphic thread readreasoning applicable covid breakthrough infection fact thread ha lovely example prevalence car different colour road accident
966,got published first time seriously ill long covid summary article britain
967,new covid symptom added official nh list free testing end
968,imagine policy like korea singapore able transplanted u uk per cent
969,long covid ha ruined life wa got ill im wa sport science major loved powerliftin
970,covid
971,chief medical officer health disappear ontarians face new wave covid new wave
972,people attendance whod recovered covid pointed bts added graphic show v cou
973,weve got staff wellmeanwhile according government theyve beaten c
974,unvaccinated person doesnt covid ha pcr test travel yet vaccinated person ha covid
975,khan managed steer country covid crisis combated institutionalized corruption forged close alli
976,shanghai lockdown due covid please stay alert vigilant far u yes really plane
977,however journal american medical assoc jan vol number page myocarditis case reported mrnabased covid vaccination u dec aug vaccination exceeded expected rate myocarditis across multiple age sex str
978,story time last year brother got covid bro wa bad shape ncr hospital full scared
979,covid weight
980,long covid ha ruined life wa got ill im wa sport science major loved powerliftin
981,covid positive hospital patient admitted care home home satisfied cared
982,new analysis oxford university show fraudsters stole around b various covid support scheme double
983,long covid ha ruined life wa got ill im wa sport science major loved powerliftin
984,course fantastic vip jung kook jhope literally recovered covid nick
985,zero covid doesnt work zero covid inhumane u recorded death china recorded death u population
986,mask mandate wa never going save south l covid heres might
987,look doctor express full support tandem vp leni robredo sen kiko pangilinan according
988,people enough dynamic zerocovid policy
989,easyjet lowcost airline based britain canceled dozen flight experiencing higher usual level emplo
990,exactly much love mum much shes treating covid big joke shes never really cared make thing difficult time
991,seeing narrative living disabled isnt life worth living unless im living hope total cure popping
992,remember covid period didnt sleep night till fajr barely get past pm
993,part colleague covid vaccine trial experience
994,covid
995,let regime propaganda medium throw child busthose turning two surrounded
996,solid analysis mistaken tweet made went viral im happy
997,devastating impact covid pandemic poor lowincome community across america laid bare new
998,classy navy football ball pattern sport premium face mask
999,afflicted pandemic much worse covid u called wokeism
1000,suho dont think song suit summerwendy perhaps bc oppas voice warmsuho wendy got clos
1001,zero covid doesnt work zero covid inhumane u recorded death china recorded death u population
1002,im sick hope dont covid got game tmr
1003,course fantastic vip jung kook jhope literally recovered covid nick
1004,thought youd interested know easyjet flight cancellation due staff cov
1005,suho dont think song suit summerwendy perhaps bc oppas voice warmsuho wendy got clos
1006,breaking ontario healthcare worker request pcr covid test accessible order track outbreak asked comme
1007,recovering covid psychological warfare man
1008,zero covid doesnt work zero covid inhumane u covid death china covid death u population mi
1009,neutrality struggle justice evilstraddling two boat end falling water
1010,seems like explosion covid case supposed getting back normal without widespr
1011,desantis ha crown prince understated fornicated covid statistic past year credibility
1012,asked around eunbis number wanted lunatic challenge eunbie ah covid let
1013,fed govt funding cut led private popup covid test site nyc either close start changing uninsu
1014,govts seem care ukraine weapon million dead covid brainwashed western slave american died covid war since wwii
1015,georgia report new covid nbsp case
1016,ive told check figure source maybe accessible number referred article
1017,didnt tory argue folk covid able return work
1018,delay noticehi fatierz would like inform might delay enhypen ggu ggu package red vel
1019,china reportedly order mass killing pet belonging covid patient
1020,sure let live covid
1021,shanghai plan test million people covid one day city lockdown separate parent chi
1022,emergence limited spread mu sarscov variant
1023,exception dark time sask newsroom itll take decade probably truth unravel shellshocked depressing process happy monday
1024,course fantastic vip jung kook jhope literally recovered covid nick
1025,covid vaccine unvaccinated aggressively threatened every day year vaccine didnt work
1026,covids batard one great pleasure enjoying first coffee day cant taste bloody thing
1027,ketanji brown jackson wanted empty jail start pandemic
1028,next take look jeffrey zients made money becoming covid coordinator tur
1029,world alright place elderly patient infected covid hospital room infected p
1030,cancel hundred flight due high level covidrelated staff sickness
1031,made far without getting covid caught today officially tested positive feel like ive hit truck teach zoom hour anyway recommend
1032,absolutely disgusting think wa funny know exactly much hate racism asian experienced past year due covid youre asian artist dont even try mask joke im disgusted
1033,man received dozen covid vaccine order get vaccination card sell people unwilling get v
1034,child missing hearing story singing conversing ha handed influencing power tv film
1035,first covid collective responsibility bend curve together okay actually thats dra
1036,oddest thing covid grifter spouting russian propaganda sudden im stumped wh
1037,sask government ha frankensteined together unnecessary provincial police force ha censored healthcare worker
1038,oh national public health week well mean time mild covid
1039,next highlight webinar closetocommunity health care provider gender covid watch
1040,really looking forward covid hit friend associate started ringing incessantly knew wa one crazy preppers ended providing local school district couple hundred ns keeping neighbor tp
1041,country world uk usa cutting edge medicine technology badly
1042,story time last year brother got covid bro wa bad shape ncr hospital full scared
1043,day covid lockdown shanghai today food key thing people mindswe arent allowed leave ho
1044,unvaccinated person doesnt covid ha pcr test travel yet vaccinated person ha covid
1045,long covid ha ruined life wa got ill im wa sport science major loved powerliftin
1046,fda explain erratic behavior bypassed expert authorize th dosegave pharma asked
1047,bidens blunder skewered president administration response covid pandemic soaring infl
1048,course fantastic vip jung kook jhope literally recovered covid nick
1049,gym unlike rest gop youll fight every law keep covid country btw science isnt strong suit looking way suited
1050,allow virus become endemicotherwise continue source political pseudoscientific force rest agitated noise
1051,heard tory voter radio said brexit failed covid wa worried fuel food bill st
1052,covid test done disha ssr ssr crime scene rule flouted
1053,airline industry get rid restriction mask flight crippling travel industryalso airline industr
1054,removal free covid test antibusiness measure risk hitting economy face spiralling c
1055,long covid ha ruined life wa got ill im wa sport science major loved powerliftin
1056,got nd booster feeling little achy big deal beat ending hospital dead serious case covi
1057,know someone got myocarditis pericarditis getting covid vaccine
1058,long covid ha ruined life wa got ill im wa sport science major loved powerliftin
1059,inflation hurt people covid ever
1060,pm narendra modi spoke israel pm naftali bennett confirmed recovering well covid discussed recent global
1061,leaving ur room risking getting covid stole ur asahi pc
1062,swedens public health agency recommending fourth vaccine dose well adult aged
1063,covid mitigation police reform trans right crt elite argued thing would prove politically toxic
1064,ivermectin enthusiast unimpressed new study showing drug effective covid treatment getting even
1065,u fda adviser discus additional covid vaccine booster via fxempire
1066,ordered four free covid testsit took literally le two minutesvery easy simple processwhile
1067,douglas ross last week nicola sturgeon must start trust scottish public keep safe doug
1068,crazy edit bts attended grammys enjoying stage like im sick tired
1069,zero covid doesnt work zero covid inhumane u recorded death china recorded death u population
1070,long covid ha ruined life wa got ill im wa sport science major loved powerliftin
1071,gave widely considered one best performance night muster cov
1072,hear ya sista im day covid brain fog unreal ditto able read watch movie anything requires minute struggle spell even find word totally opposite normal way
1073,wa ill fuck summer week totally bedridden fever stomach issue positive pcr test week ago mildish cold positive pcr test worth covid pas unvacced need travel fucking way illness pathogen
1074,completes covid quarantine
1075,high level staff absence result covid infection ha led cancellation delay british airway alone ha
1076,wonder accomplice think forget forced tiny kid school
1077,expected absolute carnage continent remember ioc stating postpone olympics covid got africa wa entire omicron episode continent wa vilified severity variant wa established
1078,abysmal trackrecord covid right anger core autism service waitlist h
1079,icymi canadian endure longest stringent public health restriction covid
1080,worst nightmare ha come true see grandad lateral flow wa coughing normal copd tested positive covid
1081,hope capstone jeffrey zients really run covid response
1082,zero covid doesnt work zero covid inhumane u recorded death china recorded death u population
1083,long covid ha ruined life wa got ill im wa sport science major loved powerliftin
1084,cdc nih prioritized studying vax complication j peds study found kid pres w myocarditis
1085,garbage democrat funded covid relief
1086,urgent know public consultation official uk covid enquiry run end th april
1087,heard tory voter radio said brexit failed covid wa worried fuel food bill st
1088,definition mild problematic eye beholderpotential loss smell taste symptom lin
1089,greet neuqun regarding event shanghai contribution share reduce cause vaccinepreventable death due lack prevention allow covid infect virus send email send carlospolastricom
1090,racist inequity health care income housing education widened covid pandemic harming health
1091,racial inequity health care income housing education widened covid pandemic harming health
1092,country world uk usa cutting edge medicine technology badly
1093,thank speaking regarding affected adverse way result covid vaccine ashamed way speaker house responded deserve treated respectful manner naughty child
1094,unbelievable yet year old grandmother wa fined attending year old friends illegal tea party seven broken police
1095,think flight cancelled due covid staff shortage imagine bad surgery canc
1096,completes covid quarantine
1097,podcasters featured jessica clark izzy imig believe covid fake conspiracy thats part biblical spiritual warfare tell rockwood family lost someone
1098,covid travs de
1099,vaccinationcaused chronic covid long term active covid infection doe clear quite dangerous
1100,pm narendra modi spoke israel pm naftali bennett confirmed recovering well covid discussed recent global
1101,happy see story gaining traction morning independent school fortunate position
1102,lie perpetrating v coughed somehow related covid dange
1103,fuck omicron xe shouldve taken covid seriously many u lazy
1104,thought youd interested know easyjet flight cancellation due staff cov
1105,wa sort test could take
1106,growing increasingly frustrated medium try portray shanghai china endless draconian lockdown strict
1107,zero covid doesnt work zero covid inhumane u recorded death china recorded death u population
1108,zero covid doesnt work zero covid inhumane u recorded death china recorded death u population
1109,hi howard sorry
1110,lie perpetrating v coughed somehow related covid dangerous literally killing people rewatched clip v never coughed wa laughing delete need issue apology report
1111,anyone else getting really fed living covid nonsense like ive ill
1112,proud deserves accolade really nd championship usc ship lock covid hit
1113,keep low key bad allowing come covid know live line
1114,desantis vote floridian died covid
1115,must million people going everyday life possibly covid sympt
1116,covid
1117,remembering feeling one year ago getting first dose covid vaccine lot life b
1118,need talk gp asap mate get phone consultation demand referral long covid clinic need start referral process asap take also mental health
1119,look doctor express full support tandem vp leni robredo sen kiko pangilinan according
1120,friday introduced covid safety pledge today promote creation safe space work
1121,new analysis oxford university show fraudsters stole around b various covid support scheme double
1122,covid case increasing people eating inside restaurant
1123,people aware hospital depleted covid theyre cancel elective surgery team
1124,first time ever american died drug overdose across month period introduced
1125,covid study published last week journal nature medicine found minuscule amount virus
1126,family walked city md get covid test uninsured told bill would sent
1127,long covid ha ruined life wa got ill im wa sport science major loved powerliftin
1128,transport canadas covid vaccine aviation medical certificate holder guidance pilot july v
1129,nothing ha changed still wear mask increased risk heart attack post month infection age group higher risk men increased complication cardiovascular neurological lung even asymptomatic long covid n pressure nh
1130,daily dose young childrens social skill suffered pandemic covid scientist catching heap ofabuse
1131,walking around giant plastic bubble year hole piss shit wear mask whenever use caught covid time last week
1132,next take look jeffrey zients made money becoming covid coordinator tur
1133,unvaccinated person doesnt covid ha pcr test travel yet vaccinated person ha covid
1134,zero covid doesnt work zero covid inhumane u recorded death china recorded death u population
1135,one year ago cdc director told got covid shot would neither get spread covid fall
1136,people attendance whod recovered covid pointed bts added graphic show v cou
1137,let take little journey see great new site work want find testt
1138,long covid ha ruined life wa got ill im wa sport science major loved powerliftin
1139,incorrect use pcr test set ridiculously high cycle count ct falsely label healthy people covid case reality pcr test proper diagnostic test although ha promoted prove wrong
1140,new analysis oxford university show fraudsters stole around b various covid support scheme double
1141,msm coverage ukraine lack depth fails mention key history clearly controlled never known
1142,douglas ross last week nicola sturgeon must start trust scottish public keep safe doug
1143,long covid ha ruined life wa got ill im wa sport science major loved powerliftin
1144,meanwhile theres overwhelming amount data support vaccination child
1145,eric schmitt wa always ha racist piece shitthe gop ha spent last two year denying covid real demanding restriction end lol soon mean also ending one keeping brown folk crossing border scream one
1146,poor american died covid twice rate rich people study study showed
1147,k per week child covid education disrupted rd year exam disrupted thousand kid af
1148,currently covid ha slowed many global economy cryptocurrency business doe impact metaoasis plan overcome
1149,fed govt funding cut led private popup covid test site nyc either close start changing uninsu
1150,covid isnt terrible rebranding effort zero covid illogical fallacy
1151,friend mild disease ha never made back work long covid symptom isnt new
1152,scientist respect like expressing doubt omicron effor
1153,hu election mostly free surely fair still opp united seemed like perfect storm think
1154,long covid ha ruined life wa got ill im wa sport science major loved powerliftin
1155,covid pandemic several community expanded pedestrian space popup outdoor seating dinin
1156,lockdown covid brutal childrenit wasnt pandemic virus wa response caused th
1157,ish man entered stoon hospital caught covid yesterday passed b c covid nurse pa tol
1158,im confused vaccinated masked people get covid blame people vaccinated
1159,need talk sweden icymi science journal nature ha published scathing assessment swedens pandemic respo
1160,urgent know public consultation official uk covid enquiry run end th april
1161,past hour alone hospital trust declared black alert due high level covid transmission h
1162,hasnt case ive covid test since first free wa required provide information ssn pay pocket last
1163,highly inappropriate mock cause covid childish making kind joke asian
1164,thanks three day covid test
1165,people aware hospital depleted covid theyre cancel elective surgery team
1166,bank england government lying actual everyday inflation far higher quotin
1167,billion waste mountain junk ppe bought tory croniesthe unusable mask gown goggles glove front
1168,back family plural hospitalized covid unit probably due local spike still demoralizing
1169,long covid ha ruined life wa got ill im wa sport science major loved powerliftin
1170,never truly lockdowns certainly tx aside march may wa like covid wasnt even thing
1171,welcome opinion surety kategutwein would one lowest stress pump population economy covid impact pm thats party compared others premier hr sure anything believe hubris folly
1172,read thread long ago people uk came across one comment lady stated embarrassed felt husband higher qualification learned people dropout high school knowledge covid scam
1173,russian denying responsible death bucha calling fake news world people willi
1174,rising seamy journey photographer wa hard wanted quit many time worked butt
1175,covid update ive interviewed well expert omicron graph opinion many truth mud
1176,yep fruit poisoned tree anyone inhuman
1177,tf wa huh stop another covid joke vile disrespectful many level smh
1178,ppl got clinical assessment centre treatment course hospital government official confirm per cent paxlovid antiviral stockpile ha dispensed patient since wa approved use month ago
1179,government watchdog accuses u postmaster general louis dejoy violating federal conflictofinterests law buying
1180,airline industry get rid restriction mask flight crippling travel industryalso airline industr
1181,expect flood tilt table reach practitioner health care meet need new dysa
1182,living covid look like business
1183,literally dont know living covid every single day people could feel actually hour nobody want living narrative masked vaxxed
1184,building success slow steady recovery witnessed tourism sector
1185,covid kill kid leave permanent disability certain treatment fo
