,tweet
1186,dad tested positive friday mam got covid dog left house infecte
1187,zero covid doesnt work zero covid inhumane u recorded death china recorded death u population
1188,yes finding rather typical respiratory disease covid appears
1189,basically every symptom every illness youve ever heard covid symptomthe hypochondriac love
1190,covid isnt dropped almost every single mandate wa keeping family
1191,people still make joke covid ha killed many people toward asian funny sh
1192,homeschooled hero nominatively destined greatness lil trapped tormented atm bc youth covid restriction etc imo genuinely one watch longterm nusantara golden age lfg
1193,family walked city md get covid test uninsured told bill would sent
1194,million people died influenza pneumonia decline influenza case million die c
1195,covid number cinema screen south africa isnt going increase anytime soon h
1196,living covid look like business
1197,people receive booster dos covid
1198,china variant omicron xe put fresh focus covid mutation virologist say soon panic
1199,whole family avoided covid year following medical leave wife reentered classroom
1200,unvaccinated person doesnt covid ha pcr test travel yet vaccinated person ha covid
1201,toddler mask mandate antiscience highlight selfishness covid restriction adult neglect young ki
1202,golfed liberal friend weekend wa excited announce nd booster shot scheduled said flu something covid said oh said cant hurt shrugged wa disappointed lack interest
1203,social medium spreading summary vp sun speech shanghai true china cling zerocovid policy
1204,australian utterly disgusted purposely chose show clip like man
1205,covid vaccine unvaccinated aggressively threatened every day year vaccine didnt work
1206,giving mind blowing performance rare see infact best performance night wa shitty covid joke already disappointed scammy grammy joke racism simply unacceptable please
1207,bulk tax mining export postcovid commodity boom really happ
1208,course fantastic vip jung kook jhope literally recovered covid nick
1209,nb covid response land personal responsibility need access tool manage ourselv
1210,zero covid doesnt work zero covid inhumane u recorded death china recorded death u population
1211,plan resume flight country including argentina south africa friendly country
1212,professionalism especially appreciated hobi jungkook straight isolation
1213,iit graduate name muhammad murtazahe wa screaming allhu akbarif wa hindu mosque omg
1214,police announce campaign restore trust lost covid theyll promise visible amongst community year visible sound like threat
1215,hi two thing really people need grow like ask covid swear people second thing thank following back tell people thank kind way told dm people sorry random thank
1216,new analysis oxford university show fraudsters stole around b various covid support scheme double
1217,easyjet cancelled around flight tomorrow high covid rate causing significant staff shortage
1218,unvaccinated person doesnt covid ha pcr test travel yet vaccinated person ha covid
1219,world health organization say new covid xe variant could transmissible one yet say
1220,wasnt staged really caught card taehyungie hyung threw really really practiced lot
1221,triple vaccinated ontarians catching covid greater rate double vaccinated vaccinated al
1222,possible anyone would vote man doesnt care one bit state greg abbott ha done nothing aside failed grid covid death
1223,sort unbelievable symptom list previously used tell people get test ha upda
1224,swedens twitter account covid stats hasnt updated turn
1225,full video jungkook going air hanging ceiling hes courageous daring
1226,jungkook prepared little ment top form could say wa good wa listening carefully c
1227,survey suggests believe weve become divided covid politics four believe society polari
1228,butterfly belongs jungkook look upset maybe exhausted covid performing taehyung always choose jungkook everyone else im sure know
1229,covids gone away local bus today sign bus bus service cut foreseeable due many driver covid covids going away
1230,congestion public transport unsafe due level covid lack mitigation cost living brexit russian buyout hm government much building record homelessness oligarch landlord multiple home
1231,nearly half student chronically absent year data show reposting address
1232,p data completely different province country
1233,forget pelosi schiff saying covid wa distraction russia collusion forget pelosi standing chinatown inviting everyone saying wa safe brainwashed david
1234,new analysis oxford university show fraudsters stole around b various covid support scheme double
1235,reducing deficit primarily cutting letting sunset lifesaving covid financial assistance something
1236,racist inequity health care income housing education widened covid pandemic harming health
1237,sense smell ha come back quite bit wa really lucky test negative think probably got tested
1238,seeing people expressing guilt self kid getting covidyou fail failed relying individual app
1239,know yet brain damage long covid bad enough push people becoming conservative voter
1240,wasnt staged really caught card taehyungie hyung threw really really practiced lot
1241,zero covid doesnt work zero covid inhumane u recorded death china recorded death u population
1242,germany restriction lifted retrogamers still wear mask
1243,long covid ha ruined life wa got ill im wa sport science major loved powerliftin
1244,super interesting new story people turn superimmune covid studying fol
1245,wa event weekend outdoors indoors indoors hotbed covid inside one time
1246,airline industry get rid restriction mask flight crippling travel industryalso airline industr
1247,malaysia sun apr covid update new case city area
1248,day covid finally feeling human however fake tan ha completely washed actually look sick ever
1249,good grief see oxford university study show fraudsters stole around billion various covid support
1250,wa treat join jodie lesh conversation ahead health last week talked covid misinformation access issue nudging better decision check conversation
1251,people aware hospital depleted covid theyre cancel elective surgery team
1252,day left say covid inquiry termsthursday deadline complete govt surveymake sure focus
1253,boris johnson dont scrap free covid testing isolation sign petition via
1254,new trialivermectin doe reduce risk hospitalization according trial brazil published n
1255,explosive watch water covid bombshell exclusive great lie revealed coming soon
1256,course fantastic vip jung kook jhope literally recovered covid nick
1257,family walked city md get covid test uninsured told bill would sent
1258,urgent know public consultation official uk covid enquiry run end th april
1259,triple vaccinated ontarians catching covid greater rate double vaccinated vaccinated al
1260,u poor died much higher rate covid rich report via fxempire
1261,speechless asshole need learn connecting covid pandemic huge know
1262,airline lift mask mandate also airline cant flytoo many employee sick
1263,upsetting news covid damage lung thyroid cause issue heart rate ha
1264,like covid ha entered house
1265,four sydney woman fb talking family going covid nd time infected th
1266,airline cancelling flight blame sickness level due covid know lie huge industry staff sho
1267,cdc isnt even transparent investigation young people died covid vaccination
1268,april kbj wrote court decision would reasonable release every person dc jail
1269,aussie army submit complaint rega
1270,covid ha bad impact almost every sector crypto project affect team done work pandemic
1271,joe biden democrat unmitigated gall suggest oil price high oil company gouging u
1272,much remains unknown ba get vaccinated get boosted twice
1273,germany restriction lifted retrogamers still wear mask
1274,basically every symptom every illness youve ever heard covid symptomthe hypochondriac love
1275,triple vaccinated ontarians catching covid greater rate double vaccinated vaccinated al
1276,course fantastic vip jung kook jhope literally recovered covid nick
1277,last event went pre covid wa amazing back last week great convos like family well run event really exciting convos hat team smashed
1278,russia plan end ban flight country april moscow continues lift covid related
1279,putting fan safety aside issue safety epik high though likelihood low could fan take thing far also covid still thing people show venue guarantee safety guaranteed protection everyone
1280,jungkook said prepared comment english interview host seems comment including expre
1281,horrific image thousand coviddeaths belgian residential care center never fade life lost never forgotten political irresponsible negligence belgian flemish level cannot stay unpunished
1282,long covid ha ruined life wa got ill im wa sport science major loved powerliftin
1283,need talk sweden icymi science journal nature ha published scathing assessment swedens pandemic respo
1284,man germany get covid shot sell forged pass
1285,two week appointment journey phone call pleading explaining severely immunocompromised son ha got covid booster thank wonderful matron charge vax queen mary roehampton relieved next
1286,scotland ha people hospital covid point pandemicthis living covid
1287,inflation hurt people covid ever
1288,think aggressive driving started quite year ago staying cooped covid aggravated also think drivers education put back high school maybe lot go away
1289,ahead african nation becoming food secure tanzania ha defied impact climate change
1290,thor weekend please help u line hes done mile
1291,didnt get covid kid didnt even try quarantine youngest son literally coughed mouth share germ
1292,gorgeous day feel coviddepressed
1293,city china million people complete lock covid restriction beating caught stre
1294,downing street staff fined police party night b prince philip funeral staff sent supermarket pack
1295,absolute nonsense expert wrong every single time government printed money regard sustainable economy covid still hospital still overrun covid spare u whitewashing govt employee
1296,urgent know public consultation official uk covid enquiry run end th april
1297,sweden pursued herd immunity policy toward covid lied drugged elderly death instead treating covid didnt tell parent child exposed covid policy republican wanted year
1298,remember vaccine would stop people catching spreading dying covid end pandemic yeah neither
1299,marihuana oldest medizine cure covid z b schamans thing coca leaf mother earth gaija medical need pharmaand money
1300,covid get blood get everywhere breath unless wear good mask well ventilated area go mouth nose whole systemvitamin g iu significantly reduces symptom
1301,covid joke never wa never funny stop making asian people butt joke
1302,heathrow airport erupted chaos morning hundred flight cancelled delayed airline hi
1303,hoping free covid testing briefly enjoyed get people wake vote single payer h
1304,pm narendra modi spoke israel pm naftali bennett confirmed recovering well covid discussed recent global
1305,officially announces citywide static management enters substantial state lockdown think
1306,hope capstone jeffrey zients really run covid response anything really chroniclesenormous applause always dan great researcher great writer great person
1307,skyhandling partner staff time demand union recognition staff report work took shit long kept shithole airport open covid company give bag sweet break u dont like leave fuk
1308,pm narendra modi spoke israel pm naftali bennett confirmed recovering well covid discussed recent global
1309,news medicare begin cover overthecounter rapid test beneficiary traditional medicar
1310,inflation hurt people covid ever
1311,chief medical officer health disappear ontarians face new wave covid new wave
1312,idc kyrie missing game cause covid kd missing game injury bk ha underachieved since kd kyrie signed take ny never happened never
1313,man germany get covid shot sell forged pass ap news
1314,stand w vladimir putini stand w dr reiner fuellmichi stand w donald trump fell hard jail timeno crime ag
1315,child aged eligible covid vaccinedr explains nh colleague wor
1316,data admitted covid apparently dont separate admitted covid people hospitalized thing testing positive
1317,course fantastic vip jung kook jhope literally recovered covid nick
1318,year old granddaughter progressing fine never wore mask even mandated never bothered socalled vaccine either dealing rd dose covid fortunately immune system well get
1319,symptom covid clear look people aware quicker
1320,im one people high risk covid since everyone obsessed individualism want know get sick die specificially fault wear mask murderer
1321,yeah covid defo cue miserly miserablists moaning facemasks
1322,win next time poll show democrat would florida would coke snorting criminal governor misinformation covid mantra silly getting old
1323,seeing torajatans already eating cocos covid unable go anywhere
1324,say probably never tested wa covid two time cough last year im sure multiple fracture left heel due fencing weight never took xray confirm deny
1325,friday office national statistic ons said million people uk estimated covid week ending march million previous week govt stop free testing point
1326,fda shuts expert authorizing another vaccine boosterdecisions like reinforce perception
1327,proposal instead making twoyearolds nyc wear cloth mask day let wear sticker say go
1328,zero covid doesnt work zero covid inhumane u recorded death china recorded death u population
1329,official government data ha compiled since google many people covid usa take right
1330,according report tigray ayder hospital staffer tested positive covid last mon
1331,scotland ha people hospital covid point pandemicthis living covid
1332,new analysis oxford university show fraudsters stole around b various covid support scheme double
1333,people turned blind eye decade sids autism case whyd stop
1334,anybody position maintain covid protection postsecondaries public school
1335,cannot understand hatred mask yr covid death people wearing mask even mandated open slather border etc death day nobody others wearing mask love mine add extra fun security layer layer chemist fibre mask
1336,theyve added symtoms covid list judging ive covid year aload rubbish
1337,ontario covid indicator point sixth wave wastewater data doubling every day test positivity rate
1338,covid
1339,need talk sweden icymi science journal nature ha published scathing assessment swedens pandemic respo
1340,course fantastic vip jung kook jhope literally recovered covid nick
1341,urgent know public consultation official uk covid enquiry run end th april
1342,course fantastic vip jung kook jhope literally recovered covid nick
1343,fda explain erratic behavior bypassed expert authorize th dosegave pharma asked
1344,long covid ha ruined life wa got ill im wa sport science major loved powerliftin
1345,covid airborne hate breathing cigarette smoke came stranger lung mouth youll
1346,star call throw caution wind covid wave like let rip wave im
1347,covid ha slowed many economy around world crypto business doe affect negatively positively still track achieve goal planning new development
1348,nah isnt delusion know full well german gas money paying politician psychopath
1349,like comment article make even surprising spent min
1350,government collect tax cigarette sale think care cost long covid youre dreaming
1351,covid diabetes colliding public health train wreck
1352,still trying get covid cat vet must pour
1353,basically every symptom every illness youve ever heard covid symptomthe hypochondriac love
1354,sask government ha frankensteined together unnecessary provincial police force ha censored healthcare worker
1355,paper flipped classroom comparison published
1356,newtrip coronavirus covid infection pregnancy
1357,family forced cut spending may usher another recession hot heel covid crunch
1358,senior citizen lying er floor feeling unwell consulted gim covid rampant ontario nursing unsuppo
1359,minister brexit opportunity refuse apologise describing fluff blaming covid inhumane rul
1360,unvaccinated person doesnt covid ha pcr test travel yet vaccinated person ha covid
1361,growing increasingly frustrated medium try portray shanghai china endless draconian lockdown strict
1362,need talk sweden icymi science journal nature ha published scathing assessment swedens pandemic respo
1363,living covid look like business
1364,talk amazing boy pulled performance night one rehearsal wi
1365,course fantastic vip jung kook jhope literally recovered covid nick
1366,sask government ha frankensteined together unnecessary provincial police force ha censored healthcare worker
1367,need talk sweden icymi science journal nature ha published scathing assessment swedens pandemic respo
1368,higgs say public health hasnt told anything long covid doesnt really show understanding w
1369,must covid every year year wa thinking wa common cold year
1370,triple vaccinated ontarians catching covid greater rate double vaccinated vaccinated al
1371,course fantastic vip jung kook jhope literally recovered covid nick
1372,course fantastic vip jung kook jhope literally recovered covid nick
1373,covid vaccine unvaccinated aggressively threatened every day year vaccine didnt work
1374,unvaccinated person doesnt covid ha pcr test travel yet vaccinated person ha covid
1375,im seeing barely anything covid thing warpeople still talking award show thing
1376,unvaccinated person doesnt covid ha pcr test travel yet vaccinated person ha covid
1377,covid remember
1378,covid vaccine unvaccinated aggressively threatened every day year vaccine didnt work
1379,last week urged nicola sturgeon trust scottish public keep safe covid yesterday tested po
1380,long covid ha ruined life wa got ill im wa sport science major loved powerliftin
1381,took walk around phi phi afternoon covid ha really hit place hard pool party many place shut including irish pub boxing bar lot incomplete project roadworks hoping fully bounce back future
1382,covid though really couldnt breathe forreal
1383,feel like world got covid right christmas got last week
1384,really hard er overloaded covid patient aggressively defend walked er part triage probably best thing go get taken care prompt care walkin clinic ha chance become emergency
1385,year shouting rooftop expand covid symptom list nh website finally happens wh
1386,new analysis oxford university show fraudsters stole around b various covid support scheme double
1387,covid infection positive test know difference
1388,week white house signed emmett till antilynching act lawboosters approved individual
1389,dont tool live covid rich privileged access
1390,one consequence sky high covid cev elderly mum ha q sick answer weekend gp
1391,free world ended covid
1392,east grinstead nursing home pass surprise inspection
1393,sure jacob reesmoggs explanation foisted covid rule population inhuman
1394,theres lot covid going around
1395,east grinstead nursing home pass surprise inspection
1396,course fantastic vip jung kook jhope literally recovered covid nick
1397,never agreed lockdown closing economy spoke often danger economically societ
1398,would prefer get covid risk neurological effect long covid need brain work
1399,biden taking credit number president wouldve realized coming pandemic wa one way number could move thats people workforce covid really hasnt done much
1400,bill gate see china perfect example country must fight covid c
1401,weve made tremendous progress fight covid million american fully vaccinated school open
1402,poor medium stop making covid joke asian
1403,social medium spreading summary vp sun speech shanghai true china cling zerocovid policy
1404,practiced lot wa worried caught covid wouldnt able properly catch card
1405,long covid ha ruined life wa got ill im wa sport science major loved powerliftin
1406,completes covid quarantine
1407,journal american medical assoc jan vol number page myocarditis case reported mrnabased covid vaccination u dec aug vaccination exceeded expected rate myocarditis across multiple age sex str
1408,long covid ha ruined life wa got ill im wa sport science major loved powerliftin
1409,course fantastic vip jung kook jhope literally recovered covid nick
1410,course fantastic vip jung kook jhope literally recovered covid nick
1411,ethan life used coviddeactivation protocol ive saved life gained slave forever dy
1412,course fantastic vip jung kook jhope literally recovered covid nick
1413,imagine covid didnt happen wtf would life like
1414,suho dont think song suit summerwendy perhaps bc oppas voice warmsuho wendy got clos
1415,bill gate see china perfect example country must fight covid c
1416,scotland coronavirus covid daily data scotland april new reported death people
1417,market propulsion type bev fcev phev hev output le kw kw kw end use private commercial geography global forecast detail
1418,cdc isnt even transparent investigation young people died covid vaccination
1419,jungkook prepared little ment top form could say wa good wa listening carefully c
1420,fox news newsmax oan network allowed american would believe trump lie election
1421,justin trudeau captain hook peter pan complex
1422,story time last year brother got covid bro wa bad shape ncr hospital full scared
1423,western diplomat ask china separate covidpositive child parent
1424,epidemiologist nurse physician artist biologist come together common anger u
1425,living covid look like business
1426,upside covid get spend time tbr pile look fabulous whilst reclinin
1427,want live protect loved one need get jab shandy got first covid vaccination earl
1428,zero covid doesnt work zero covid inhumane u recorded death china recorded death u population
1429,flu vax day tomorrow dont forget covid flu time thing bad
1430,point doe article consider possibility african government adopted effective covid mitigation pol
1431,month still unable work miss purpose trying live esa impossible photo wa th
1432,bill gate see china perfect example country must fight covid c
1433,state health official say congressional gridlock billion new pandemic money ha undermined effort transiti
1434,easyjet cancel hundred flight due high level covidrelated staff sicknessthe airline cancelled flight weekend monday passenger given short notice sky news consequence covid restriction
1435,q earnings recession startedall company missing top botton line earnings would blame everything bidenn inflatio
1436,still blaming covid
1437,mindset abhorrent sofi said person repeatedly party unmasked share publicly im going presume dont care covid precaution get covid im going presume likely enough fault im blaming
1438,covid mass testing healthy people must stop
1439,china ha deployed military medic medical worker shanghai recent day help tame
1440,course fantastic vip jung kook jhope literally recovered covid nick
1441,covid slowed progress toward global sustainable energy goal
1442,basically every symptom every illness youve ever heard covid symptomthe hypochondriac love
1443,suho dont think song suit summerwendy perhaps bc oppas voice warmsuho wendy got clos
1444,australia ha demandrecession forum long time covid struck recession caused wage benefit stagnation simple deliberate
1445,sure jacob reesmoggs explanation foisted covid rule population inhuman
1446,new analysis oxford university show fraudsters stole around b various covid support scheme double
1447,new analysis oxford university show fraudsters stole around b various covid support scheme double
1448,bill gate see china perfect example country must fight covid c
1449,minister brexit opportunity refuse apologise describing fluff blaming covid inhumane rul
1450,cdc nih prioritized studying vax complication j peds study found kid pres w myocarditis
1451,tell people lifted absolute poverty china would like go back starvation long
1452,let talk jk recovered covid barely joined boy hobi flew jin
1453,feedback sector show impact covid ha led heightened level anxiety around exam assessmentsour latest spotlight help tackle
1454,april kbj wrote court decision would reasonable release every person dc jail
1455,reassurance covid vaccine systematic review led
1456,stop harassing nursing staffmake extension chacovid health assistantswe great
1457,anyone want explain changed surveillance dashboard l
1458,er even though really didnt want go dr told wont let wait outside despite highrisk f
1459,pm narendra modi spoke israel pm naftali bennett confirmed recovering well covid discussed recent global
1460,devastating impact covid pandemic poor lowincome community across america laid bare new
1461,study predicts covid death rebound restriction lifted harvard gazette
1462,let talk jk recovered covid barely joined boy hobi flew jin
1463,pune weve appealed govt everyone need travel need take booster dose theyre internal
1464,bill gate see china perfect example country must fight covid c
1465,course fantastic vip jung kook jhope literally recovered covid nick
1466,nefarious activity wa jared likely involved jamal khashoggi murder grift blue state covid reli
1467,ish man entered stoon hospital caught covid yesterday passed b c covid nurse pa tol
1468,motherfucker wa marinating covid crockpot come looking like
1469,covid hasnt vanished get vacinated
1470,zero covid doesnt work zero covid inhumane u recorded death china recorded death u population
1471,around people given drug provincial covid clinical assessment centre treatment course
1472,restrict pcr testing drop vaccine mandate eliminate mask mandate go back normal explosive sixth wave also suddenly like covid hasnt concern many two year
1473,established diagnostic criterion long covid established diagnostic laboratory imaging study long covid science make shit
1474,family walked city md get covid test uninsured told bill would sent
