,tweet
588,covid longer problem illegal immigrant crossing border american still wear mask
589,toilettattling trump covid adviser criticizes smart toilet proposal covid testing news
590,updatej k report covid positive case k case reported still ha covid active case
591,devastating impact covid pandemic poor lowincome community across america laid bare new
592,anyone else still masking handwashing covidfree
593,especially encouraging knowing one first sign new covid variant vomiting
594,highly vaccinated facing double trouble deadly hong kong variant ba rise country
595,covidrelated hospital admission ontario v recent week dr isaac bogoch tweeted earlier week
596,experimental definitely vaccine know long term safety effect covid infectees suffer symptom harm die vastly higher risk vaccination
597,covid ha finally caught feel okay everything taste like metal vibe
598,dont tool live covid rich privileged access
599,x politics expertise
600,johnsons government ha given covid passed cost responsibility individual companiesthey ev
601,seeing passion play oberammergau bucket list fascinating backgrounder tradition return year covid delay
602,posted video got k view k comment msm gov done great job brainwashing america key fact missing kid risk covid shot dont stop spread everyone disagrees reddit reply pure vitriol
603,course fantastic vip jung kook jhope literally recovered covid nick
604,course fantastic vip jung kook jhope literally recovered covid nick
605,system cannot healthy information flow distorted subtweeting everything oil gas subsidy making covid testing harder access
606,inflight mask mandate dropped th march one week later many staff covid flight cancelledthanks
607,let talk jk recovered covid barely joined boy hobi flew jin
608,covid british airway cancel flight due staff absence
609,heck attacking kim taehyung purposefully never coughed
610,dear yearold grandson go jk mom taught never ever take mask
611,point doe article consider possibility african government adopted effective covid mitigation pol
612,new analysis oxford university show fraudsters stole around b various covid support scheme double
613,people still make joke covid ha killed many people toward asian funny sh
614,professionalism especially appreciated hobi jungkook straight isolation
615,sense smell ha come back quite bit wa really lucky test negative think probably got tested
616,plan lower insulin cost release million barrel oil day
617,label dr malone covid misinformation influencer latest covid misinformation star say invented vaccine via
618,fuck omicron xe shouldve taken covid seriously many u lazy
619,point outrageously high death count many cant protected long covid evidence much
620,still killing hundred american every day many around worldthey forgotten
621,suho dont think song suit summerwendy perhaps bc oppas voice warmsuho wendy got clos
622,im actually terrified possibly getting long covid
623,crazy edit bts attended grammys enjoying stage like im sick tired
624,personally know ppl whove caught covid first time last week boston shit gonna get
625,fda explain erratic behavior bypassed expert authorize th dosegave pharma asked
626,lmao think thats work lack knowledge astounding youre cargo cult equivalent covid prevention
627,long covid ha ruined life wa got ill im wa sport science major loved powerliftin
628,long covid ha ruined life wa got ill im wa sport science major loved powerliftin
629,following hub accommodating covid vaccination cityschedule
630,long covid ha ruined life wa got ill im wa sport science major loved powerliftin
631,zero covid doesnt work zero covid inhumane u recorded death china recorded death u population
632,easyjet cancel flight staff covidpeople cant get away covid really hasnt gone awaymadnes
633,authoritarian used covid augment nation law perpetuating time officeso openly cheer dictator
634,journal american medical assoc jan vol number page myocarditis case reported mrnabased covid vaccination u dec aug vaccination exceeded expected rate myocarditis across multiple age sex str
635,heathrow airport erupted chaos morning hundred flight cancelled delayed airline hi
636,need talk sweden icymi science journal nature ha published scathing assessment swedens pandemic respo
637,ive doubled fuel bill wrecked economy killed people covid wrecked british industry torybrexi
638,least safe covid ig
639,hi looking possibility need confer konferenz zentrum term infrastructural capacity covid regulation info announce hope help hope work
640,read
641,remember one president actually highly upsetting xi calling covid china virus wonder likely corrupt tie china trump family biden family remember people thought trump would start ww china including traitor milley
642,im telling wear mask wear mask flu season prior covid suspect since tv told covid bad
643,people attendance whod recovered covid pointed bts added graphic show v cou
644,yup keeping list covid sarscov infection lead follow hashtags like find
645,zero covid wa prevailing view aim complete containment slower growing virus lack tool hope
646,yeah covidlooks like covid mehigh temperature definitely covidfell ladder yep thats covidcrashed car yet another covid symptom
647,ha deliberately misled parliament ha found guilty act resulting criminal sanction ha
648,indian pm modi speaks israel pm discussed indo israel tie global issue india visit later year
649,daily mail utmost best morning rally lockdown face another preventable wave lot story lockdown horror story many people keep getting sick ending maimed dead covid
650,medical team frm china including wuhan arrived shanghai deal covid outbreak
651,nationalisation bank bank country took giant leap towards economic reliance
652,scotland ha people hospital covid point pandemicthis living covid
653,one many year trial use disease pose far greater risk child covid yes dont think anyone ha problem youre dope
654,new analysis oxford university show fraudsters stole around b various covid support scheme double
655,addl note long covid due politicization certain early treatment make room massive vaxx push always unsolved mystery many life could saved longcovid symptom prevented proper early treatment
656,periodic reminder congress mandated collection trove data would made much easier
657,suggestion million dos covid vaccine expiring month p dose worth p
658,took seven hour per week month watching cnn significantly transform fox viewer perception covid
659,woke feeling horribly nauseated alert id exposed covid probably bus im going right back bed pretended morning didnt happen
660,damning evaluation science advice covid pandemic sweden brusselaers et al paint grim picture
661,anybody confused beomgyu basically saying think got tested covid already rec
662,scotland ha people hospital covid point pandemicthis living covid
663,iit graduate name muhammad murtazahe wa screaming allhu akbarif wa hindu mosque omg
664,cdc nih prioritized studying vax complication j peds study found kid pres w myocarditis
665,retired year ago became heavily involved politics covid social medium twitter fb tube channel reading book politics culture war etc etc national international wa day passed
666,gg see false ukrainian narrative gg still keeping covid narrative ha come sens
667,good morning folk evidence fact infected covid right coming wee
668,fda explain erratic behavior bypassed expert authorize th dosegave pharma asked
669,medicare medicaid still cover pcr test covid hrsa reimbursement fund uninsured testing mo
670,free covid testingmonday april pmtarentum st united presbyterian church lock street tarentu
671,everybody made money low tax energy independent inflation got vaccine started biden quit saying biden got rid covid
672,federal modelling show clear uptick covid case via
673,sharing photo amazing wife katie work im trying show world katies death covid
674,jungkook prepared little ment top form could say wa good wa listening carefully c
675,hi john dont look well covid john mate flume know john oh ive testing day im still negativeme well look mr money bag
676,covid hasnt gone away elderly mom tested positive today lost three cousin pandemic well back home
677,one magazine artical screen shot know full report say mask protect unconditionally covid need prove point otherwise youre wearing mask reason
678,utter disaster china zero covid policy ha exposed army wa deployed shanghai
679,hotel transmission omicron two fully vaxxed people across corridor hepa itpersonall
680,lie perpetrating v coughed somehow related covid dange
681,people attendance whod recovered covid pointed bts added graphic show v cou
682,new article asks comms expert including carly kuper svp public relation corporate communication done differently pandemic communication particularly avoid health misinformation
683,lie perpetrating v coughed somehow related covid dange
684,neutrality struggle justice evilstraddling two boat end falling
685,im currently suffering covid celebration twitter thread describing covid lockdown project ha
686,big fuck bloody racist asian hate crime time high yall cant get enough covid joke really
687,unvaccinated person doesnt covid ha pcr test travel yet vaccinated person ha covid
688,unvaccinated person doesnt covid ha pcr test travel yet vaccinated person ha covid
689,cdc guideline blatantly political new recommendation aim convince public pandemic
690,covid officially apparently longer need testing irony lost none except g
691,didnt tory argue folk covid able return work
692,sul consenso poi mentioned proposal clinical case definition likely temporary new data continue emerge initial report describing post covid condition small patient sample inherent short followup likely subject bias
693,much remains unknown ba get vaccinated get boosted twice
694,course fantastic vip jung kook jhope literally recovered covid nick
695,conspiracy proving correct tho vac harm instance read book download sample youll find vac latest covid symptom headache blocked nose hmmm oh child
696,cdc isnt even transparent investigation young people died covid vaccination
697,free covid testingmonday april pmnorth park pool parking lotsouth ridge drive allison park pa
698,well follows science seems le certain one thing pretty established jumping straight nazi comparison tad melodramatic im particularly worried covid fascist tyranny
699,newest data brunch episode talk covid border accountability project tracking international
700,got covid
701,pace someone sneeze next county everyone covid
702,den twinning covid
703,friend daughter ha told must come work even though ha positive test covid ill sneezin
704,wasnt rich saved u covid wa low paid key worker govt asked u clap
705,cdc isnt even transparent investigation young people died covid vaccination
706,im nurse got covid week ago wa floored feeling illit massive
707,ok follow anyone know happened reusable cup scheme seemed disappear covid hasnt returned game came back sanitisation thing
708,many new york resident told wear mask covid spread
709,weverse announcement jungkook ha made full recovery covid ha approved perform g
710,pm narendra modi spoke israel pm naftali bennett confirmed recovering well covid discussed recent global
711,bill gate see china perfect example country must fight covid c
712,course fantastic vip jung kook jhope literally recovered covid nick
713,people around panic covid spike protein induced aid unfunded pension liability systemic dollar collapse
714,pic make feel wholelot better even covid
715,detail swedish policy described new study horrifying swedish government deliberately tried
716,buffettbacked byd otcpk byddf end production combustion engine carshospitals heading turbulence covid admission drop deutsche bankintel intc new gpus show promise nvidia nvda still ha advantage
717,would love see survey regarding reason happening like covid theater endless booster wokeindoctrin
718,long covid ha ruined life wa got ill im wa sport science major loved powerliftin
719,vicepremier sun chunlan urged resolute swift action control outbreak shanghai shortest time
720,new national covid death occupation worker risktop sectorsa
721,covid management ha already seen death
722,said postpandemic airport chaos largely due high level staff absence way
723,another thing besides covid prevented lockdown bank run riot due lost money
724,hesitated secondsdon worry logic supporter dead covid next election
725,thank inviting along would good flail around person im glad pulled im covid positive right
726,government learn live covid covid
727,course fantastic vip jung kook jhope literally recovered covid nick
728,part colleague covid vaccine trial experience
729,free covid testingmonday april pm pmyoung scholar western pa newport drive pittsburgh pa
730,long covid
731,people still make joke covid ha killed many people toward asian funny sh
732,covid oh yes covid flight jersey london luton glasgow unable fly scheduled easy
733,bee propolis taken supplement form ha antiviral property may help covid
734,wasnt staged really caught card taehyungie hyung threw really really practiced lot
735,supporter come hes fighting war hes working hard hes delivered brexit survived covid itu never lie
736,completes covid quarantine
737,airline improve postcovid payment experience via
738,would prefer graph show percentage population hospital due covid graph always given impression risk hospitalization wa high yet hasnt observationally true two year period
739,lie perpetrating v coughed somehow related covid dange
740,way getting pcr test england either cheap free child ha tested positive assume want get record actually covid incase u suffer future health problem due government forced infection
741,need talk sweden icymi science journal nature ha published scathing assessment swedens pandemic respo
742,sure let live covid
743,ruined entire segment push asian covid b delete reedit rem
744,today due chinas zerocovid policy every person china suffering covid infection due zerocovidpolicy n
745,since need damn shot flu people quadruple vaxxed still getting covid dying im sure figure doesnt work
746,full video jungkook going air hanging ceiling hes courageous daring
747,basically every symptom every illness youve ever heard covid symptomthe hypochondriac love
748,easyjet cancel flight staff covidpeople cant get away covid really hasnt gone awaymadnes
749,couldve dragged covid decade played whole vaccine thing pushed fast kept trying stick narrative started fall pieceswill save u dunno see strategic play
750,returned teaching last mon year away taught line wa medical lea
751,friendly reminder wasnt ceo billionaire saved u covid first wave wa janitor nurse
752,need talk sweden icymi science journal nature ha published scathing assessment swedens pandemic respo
753,hope youre feeling better soon frienddid doctor take covid test went hospital yesterday know isnt likely might worth asking need go back
754,jk hobi recovering covidjin finger injury one day ot practice travelling concert preparationthey work ha
755,jungkook prepared little ment top form could say wa good wa listening carefully c
756,striking poster american college cardiology conference showing strong association mrna covid vaccine
757,inna lillahi wa inna ilayhi rajiun mother passed morning please keep duas worst three month life
758,inflation hurt people covid ever
759,british airway flight heathrow airport cancelled monday fifty cancelled advance
760,report released monday april includes interactive map detail u count
761,people attendance whod recovered covid pointed bts added graphic show v cou
762,course fantastic vip jung kook jhope literally recovered covid nick
763,fuck omicron xe shouldve taken covid seriously many u lazy
764,summary tory rule price lorry queue supply chain job loss labour shortagecovid criminal mismanag
765,man must superhuman jab
766,whereas elderly greatest risk dying covid age likely develop
767,big fuck bloody racist asian hate crime time high yall cant get enough covid joke really
768,im confused vaccinated masked people get covid blame people vaccinated
769,course fantastic vip jung kook jhope literally recovered covid nick
770,fucking covid againits didnt listen bad yall ill back twitter
771,covid ha bad impact almost every sector crypto project sffect team work pandemic
772,kind medium disrespect towards taehyung making joke covid funny shit
773,democrat outnumber republican also trump covid republican number decreased voted trump never president ever
774,airline industry get rid restriction mask flight crippling travel industryalso airline industr
775,dont forget second shot received either pfizer moderna covid vaccine need second dose
776,lie perpetrating v coughed somehow related covid dange
777,said postpandemic airport chaos largely due high level staff absence way
778,lol say guy lied constituent covid mask vaccine leading mass injury death texan
779,stanford university doesnt close entirely spring break student trickle back latt
780,least surprising headline week ivermectin proven useless covidget vaccinated boosted wear
781,free covid testingmonday april pmgoodwill monroeville monroeville blvd monroeville pa
782,imagine covid didnt happen wtf would life like
783,unvaccinated person doesnt covid ha pcr test travel yet vaccinated person ha covid
784,bipartisan senate deal billion covid aid expected announced soon today per multiple source
785,result current high rate covid infection across europe like business experiencing
786,wasnt rich saved u covid wa low paid key worker govt asked u clap
787,covid safety broke rule height pandemic
788,daily u covid death distribution county data latest covid insight analytics team using usafacts
789,weird little bit sick covid every test ive taken im sure itll come back positive far never
790,journal american medical assoc jan vol number page myocarditis case reported mrnabased covid vaccination u dec aug vaccination exceeded expected rate myocarditis across multiple age sex str
791,near absolute view present twitter degree irlone inevitablethe zero
792,biden harris simbolically harb wa made one covid putin anyway
793,late delete clowncovid death biden trump
794,canadian becoming divided covid politics survey say
795,kan dont understand like saying covid thing asian people like dont covid
796,article compare western medium covid infects everyone supporter political change russia criti
797,oddest thing covid grifter spouting russian propaganda sudden im stumped wh
798,cdc nih prioritized studying vax complication j peds study found kid pres w myocarditis
799,long covid ha ruined life wa got ill im wa sport science major loved powerliftin
800,let talk jk recovered covid barely joined boy hobi flew jin
801,day covid lockdown shanghai today food key thing people mindswe arent allowed leave ho
802,top form top formi prepared comment wasnt asked said goodi wa waiting like g
803,germany restriction lifted retrogamers still wear mask
804,lavrov get covid good one
805,police saying true apparently neighbor uncle fell wa trying get police arrive uncle wa walking around shooting uncle recovering covid couldnt walk step without tired uncle wa good guy
806,something think new oxford study show govt loss fraud covid doe anybody sti
807,fuck omicron xe shouldve taken covid seriously many u lazy
808,dont know single unvaccinated person got myocarditis covid
809,new analysis oxford university show fraudsters stole around b various covid support scheme double
810,postpandemic covid absence
811,funny triple jabbed folk testing positive covid test vaccination wa ill day like would cold
812,long covid ha ruined life wa got ill im wa sport science major loved powerliftin
813,long covid ha ruined life wa got ill im wa sport science major loved powerliftin
814,free covid testingmonday april noonneighborhood resilience project beford avenue pittsburgh p
815,long going wear mask ill wear one covid risk subsideit easy take maskit hard
816,im confused vaccinated masked people get covid blame people vaccinated
817,pakistan year april fool wa delayed due covid april rd lol
818,suho dont think song suit summerwendy perhaps bc oppas voice warmsuho wendy got clos
819,today founder director signed covid safety pledge beh
820,tested positive covid wonder throat wa exploding yesterday
821,ppl say zero covid cost u actively experiencing mass disability event du
822,im listening yearold grandchild died covid cleveland couple urge teen get vaccinated coronavirus wksu app
823,friend ive almost every day past week ha covid
824,dont feel failure partner died covid failure part im alone died alternative would dream come true
825,bipartisan senate deal billion covid aid expected announced soon today per multiple source
826,need demand workplace clean air like clean water take grant
827,china variant omicron xe put fresh focus covid mutation
828,covid lockdown tyranny cause mass uprising china week
829,need talk sweden icymi science journal nature ha published scathing assessment swedens pandemic respo
830,government ignoring human health protocol allowing covid rip
831,long covid ha ruined life wa got ill im wa sport science major loved powerliftin
832,covid mitigation police reform trans right crt elite argued thing would prove politically toxic
833,cdc nih prioritized studying vax complication j peds study found kid pres w myocarditis
834,ba easyjet cancel hundred flight amid covid staff sickness airline industry guardianeasyjet ha cance
835,triple vaccinated ontarians catching covid greater rate double vaccinated vaccinated al
836,amazing cultist believe trump care act innocent part shortage economic coll
837,hope mum ok smudge ab totally agree covid b time stop
838,look successfully treating long covid
839,together trial biggest trial ivermectin covid wa published recently finding mostly null p
840,youre wrong
841,virus city le mile evo
842,personal circumstance young old vaxxed unvaxxed immunocompromised salaried v front line already touched covid sc
843,ba easyjet cancel hundred flight amid covid staff sickness airline industry guardianeasyjet ha cance
844,flu people many time ok getting flu ignoring
845,strike symptomatic individualistic capitalist ideology many follow collectivist logic relation co
846,friendly reminder wasnt ceo billionaire saved u covid first wave wa janitor nurse
847,thinking thisrecalling ha occupied parliament rf since mock interview one year ago seems longer huh covid philips death hospital building vaccination rollout queens health andrew furore riot protest war europe lets pray time
848,australia news live update lismore mp say federal government need step flood support fear hiker afte
849,suho dont think song suit summerwendy perhaps bc oppas voice warmsuho wendy got clos
850,agreedthey closed shanghi populated city earth covid spike million people lockdown
851,pray th wave hit u prudent lower guard yetthe confusing announcemen
852,covid doesnt enact mandate liberal government
853,document lost covid supply never delivered stolen despite public health age
854,germany restriction lifted retrogamers still wear mask
855,covid vaccine unvaccinated aggressively threatened every day year vaccine didnt work
856,china orchestrating covid scare whats game pl
857,phela covid doesnt involve heart feeling yeah tlo shwa ke mjolo stru go crazy
858,covid make cosplay
859,multiple debilitating syndrome lasting month year minimizing covids risk public increase ha
860,unvaccinated person doesnt covid ha pcr test travel yet vaccinated person ha covid
861,long covid ha ruined life wa got ill im wa sport science major loved powerliftin
862,got published first time seriously ill long covid summary article britain
863,taken basic statistic class basic gap logic huge make intelligent dialog impossible
864,new analysis oxford university show fraudsters stole around b various covid support scheme double
865,im really looking forward wednesday fda advisory committee meeting discus decision wa already made without input fda shuts expert authorizing another vaccine booster wsj
866,always voted tory covid came family died brother mum dear uncle big disappointment many pay poll worst put jail work tory hq time protect make note
867,nurse make largest section mental health workforce uk impact pandemic ha work ha largely ignored happy nurses experience important role getting attention
868,free covid testingmonday april pmgoodwill west mifflin mountain view drive west mifflin pa
869,inflight mask mandate dropped th march one week later many staff covid flight cancelledthanks
870,uninsured youre greater risk severe illness covid complication cant afford pay vaccine treatment
871,unvaccinated person doesnt covid ha pcr test travel yet vaccinated person ha covid
872,zero covid doesnt work zero covid inhumane u recorded death china recorded death u population
873,today people tested positive people hospital yesterday whi
874,new analysis oxford university show fraudsters stole around b various covid support scheme double
875,example many people know dozen people positive covid sick covid particularly many
876,hey world haste go back precovid time causing delay bringing time
877,cant even imagine incredible dumb comment litterly ha covid f deny yes different flu lot people also lot people symptons mild whats point
878,course fantastic vip jung kook jhope literally recovered covid nick
879,covid example one least subtle u intelligentsia often lay reactionary shift
880,organiser confirmed many pointed anyway conference registration fee higher year venue hire cost increased postcovid fullyhybrid meeting needed cost thread
881,would like find truth behind aussie doctor restricted expressing opinion
882,course fantastic vip jung kook jhope literally recovered covid nick
883,evidently covid spread fairly well school remove public health measure
884,cant believe many people positive covid test day ive explain safe return
