,tweet
0,covid denier website next
1,scotland ha people hospital covid point pandemicthis living covid
2,want pandemic end trying away arent helping u get closer also ive noticed
3,world health organization say new covid xe variant could transmissible one yet say
4,covid vaccine unvaccinated aggressively threatened every day year vaccine didnt work
5,free idea floating covid hospital bottom sea ornament evacuation ship ukrainian woman child mel
6,graduation day first person test since covid also minute break fast
7,heartbroken say final alra south third year school ha unexpectedly closed industry
8,long covid ha ruined life wa got ill im wa sport science major loved powerliftin
9,story surprised way make money
10,real effect congress continuing funding
11,im upset yall still making covid joke asian even find joke funny anymore
12,half million active case covid australia right wow
13,course fantastic vip jung kook jhope literally recovered covid nick
14,course fantastic vip jung kook jhope literally recovered covid nick
15,ba easyjet cancel hundred flight amid covid staff sickness airline industry guardianeasyjet ha cance
16,country world uk usa cutting edge medicine technology badly
17,hospital overloadedwe school closingwe aircraft grounded holiday cancelledbut sure jacob
18,nefarious activity wa jared likely involved jamal khashoggi murder grift blue state covid reli
19,psa administration announces new way beneficiary get free overthecounter test
20,look page finally released covid vaccine causing multiple health pro
21,french ambassador thailand thierry mathou handed million dos pfizer covid vaccine prim
22,long covid ha ruined life wa got ill im wa sport science major loved powerliftin
23,unvaccinated person doesnt covid ha pcr test travel yet vaccinated person ha covid
24,course fantastic vip jung kook jhope literally recovered covid nick
25,start covid official smart people warned u big risk wa society shared resolve take coll
26,dont dispute benefit vaccine forcing problem especially covid vaccine working well preventing spread
27,car parking lot minute wait table utilized far seen short server get
28,tired selfish covid get ityour yo child yo grandma sick wear gd mask
29,many doctor idea long covid diagnose brush offthese doctor actively harming patient need kicked profession
30,zero covid doesnt work zero covid inhumane u recorded death china recorded death u population
31,course fantastic vip jung kook jhope literally recovered covid nick
32,anyone else still masking handwashing covidfree
33,bill gate see china perfect example country must fight covid c
34,c sunshine average apr maine stay warm well covid
35,izegem covid amb n izegem
36,thank need wellwishes get playing dodgem covid see ailing grandpa
37,fuck omicron xe shouldve taken covid seriously many u lazy
38,izegem covid amb n izegem
39,people attendance whod recovered covid pointed bts added graphic show v cou
40,fuck omicron xe shouldve taken covid seriously many u lazy
41,fed govt funding cut led private popup covid test site nyc either close start changing uninsu
42,much covidamongst medical colleagueswhere get kid physician cant p
43,oh gotta love wa health   seriously got sorted covid people daughter worse free
44,family walked city md get covid test uninsured told bill would sent
45,epidemiologist nurse physician artist biologist come together common anger u
46,family walked city md get covid test uninsured told bill would sent
47,breaking jacob reesmogg ha described governments covid lockdown rule inhuman year old vampire
48,unvaccinated person doesnt covid ha pcr test travel yet vaccinated person ha covid
49,unvaccinated person doesnt covid ha pcr test travel yet vaccinated person ha covid
50,even mild covid appear higher risk heart problem one year infection according one largest study evaluate longterm cardiovascular outcome covid
51,long covid ha ruined life wa got ill im wa sport science major loved powerliftin
52,dcp trimukhe feigned covid cbi wanted question went awoldidnt secure crime scene called doctor befor
53,long covid ha ruined life wa got ill im wa sport science major loved powerliftin
54,know people reaction vaccine bcuz expert claim covid told truth
55,heartbroken say final alra south third year school ha unexpectedly closed industry
56,european union ha accepted malaysia digital covid vaccination mysejahtera travel throughout regioneu
57,unfortunately false protection severe disease wane considerably even postbooster remember waning
58,pm narendra modi spoke israel pm naftali bennett confirmed recovering well covid discussed recent global
59,considering wildly different virus seems present different people yeah answer definitely take covid test
60,stand hunter laptop real biden family sell access president obama knew hillary invented russian
61,germany restriction lifted retrogamers still wear mask
62,removed protection needed whats happening surprisingfor vacci
63,reminds pro vacxers going abt hw ppl shud fired vaccinated hw everyday told r putting ppl life danger nt vaccinating reminds hw everyday dead people paraded killed covid
64,week ive heard many many student concerned falling farther behind many
65,periodic reminder congress mandated collection trove data would made much easier
66,carrie lam led hong kong antigovernment protest covid pandemic say wont see another term chief
67,lasted month three trip hospital fever three week cried mama died wa covid wasnt nearly bad
68,dealing covid critical convinces people accept total biometric su
69,need talk sweden icymi science journal nature ha published scathing assessment swedens pandemic respo
70,covid test maybe
71,dealing covid critical convinces people accept total biometric su
72,jesus christ one news went story reduce covid restriction without hint irony
73,basically every symptom every illness youve ever heard covid symptomthe hypochondriac love
74,china covid crisis grows case surging new substrains
75,dont expect answer soon regimes embezzlement fund cartel
76,got published first time seriously ill long covid summary article britain
77,bill gate see china perfect example country must fight covid c
78,travelling today union station holding special oneday clinic union station
79,join u panel discussion covid ha reshaped fair housing guest speaker includ
80,people enough dynamic zerocovid policy
81,lie perpetrating v coughed somehow related covid dange
82,u hhs new way medicare beneficiary get free overthecounter covid testspeople medicare get covid test per calendar month participating pharmacy health care provider reuters
83,suggestion china wa cahoot democrat stealing election true
84,also wa recently job hunting declined hospitality work purely covid safety reason
85,nine new covid symptom added official nh list shortness breath tiredness exhaustion achi
86,whereas elderly greatest risk dying covid age likely develop
87,new analysis oxford university show fraudsters stole around b various covid support scheme double
88,news goves secret scottish independence spy poll wa paid covid recovery fund court say wa
89,long covid ha ruined life wa got ill im wa sport science major loved powerliftin
90,chief medical officer health disappear ontarians face new wave covid new wave
91,village overspilling onto allotment covid corps shippin containersif covid isnt realwherestheco
92,douglas ross last week nicola sturgeon must start trust scottish public keep safe doug
93,hospital overloadedwe school closingwe aircraft grounded holiday cancelledbut sure jacob
94,many asian die suffer asian hate escalated covid pandemic
95,legal tell u cant enact suchandsuch protect covid lets see happen
96,carrie lam hong kongs chief executive wont seek second term widely criticized amid city covid outbre
97,unvaccinated person doesnt covid ha pcr test travel yet vaccinated person ha covid
98,douglas ross last week nicola sturgeon must start trust scottish public keep safe doug
99,waste money front left centre hide covid money enough u
100,e ancora many pending answer surrounding covid sequela remain new question constantly formulated definition post covid condition help advance advocacy research likely change new evidence emerges
101,guy regarding racist segment australian primetime tv show project encourage tweet th
102,researcher included timeline swedens health measure key event early part pandemic correlated
103,swedens twitter account covid stats hasnt updated turn
104,working manuscript lancet commission vaccinating prevent longcovid feel though longcovid
105,rysei nakao voice frieza ha tested positive covid april rdwishing speedy recovery
106,umm seen multiple tweet ig story point people saying sinus infection might
107,get mess quickly mean ffs covid wa completely according johnson june j
108,family walked city md get covid test uninsured told bill would sent
109,working manuscript lancet commission vaccinating prevent longcovid feel though longcovid
110,covid devastating toll poor lowincome community u
111,slashing bn global aid bidens emergency covid package would impact effort stamp virus globall
112,ha soy milk gone bad tea taste like mcdonalds chip grease like taste like taste eating mcdonalds chip kind long covid
113,feature politicized zero covid strategy failed stop predictable outbreak hong kong potentially relevant reading omicron spread rapidly china lead lockdown major city like shanghai shenzhen
114,covid travel chaos bloody eu regulation
115,remember town hall event july hosted cnns lemon president joe biden assured country vaccinated would contract covid believe example bullshit like score political point also major contributor
116,wonder hear apology folk held sweden proof covid wa big deal
117,get partially reimbursed covid test buy drugstore mile away ha none stoc
118,housetohouse visit start nigerian react jehovah witness open kingdom hall two year covidlockdown
119,new analysis oxford university show fraudsters stole around b various covid support scheme double
120,practiced lot wa worried caught covid wouldnt able properly catch card
121,fun fact scienceorg finding support conclusion covid vaccine remain important tool prevent infection death vaccine accompanied additional measure vaccinated unvaccinated person including masking hand washing
122,people attendance whod recovered covid pointed bts added graphic show v cou
123,covid longer problem illegal immigrant crossing border american still wear mask
124,nh alone ha reported day lost nh staff absence englandthe delivering goal enc
125,nh ha come another symptom covid
126,whole family avoided covid year following medical leave wife reentered classroom
127,b tested negative covid proceeded tell friend doesnt look good brb front office calling
128,exc police issuing fine downing street staff partied night prince philip funeral rev
129,thought youd interested know easyjet flight cancellation due staff cov
130,warning released today direct quote newest variant coronavirus doe lead severe symptom
131,news medicare begin cover overthecounter rapid test beneficiary traditional medicar
132,gave widely considered one best performance night muster cov
133,unvaccinated person doesnt covid ha pcr test travel yet vaccinated person ha covid
134,hospital overloadedwe school closingwe aircraft grounded holiday cancelledbut sure jacob
135,baaack yesterday open talk covid weekly update available
136,wa strategy allow local channel especially tbc decoder allow bunge live legitimize covid allow political rally gathering meeting allow team used stealing election cc allow tume huru steal election repeat
137,covid travel chaos bloody eu regulation
138,course fantastic vip jung kook jhope literally recovered covid nick
139,long covid ha ruined life wa got ill im wa sport science major loved powerliftin
140,one ha ever covid mean one ha ever died think im wrong prove
141,many people swallowed theyve told pro nothing level normal range youre fine stop even keeping track feel wonder laissez faire attitude toward long covid
142,wow weiqin article explains weekend medical personnel shipped china sh
143,periodic reminder congress mandated collection trove data would made much easier
144,actually asked senior demographic denmark willing sacrifice life keep school open said yes well respond aware covid death close way let rip
145,course fantastic vip jung kook jhope literally recovered covid nick
146,family walked city md get covid test uninsured told bill would sent
147,really feel like talking enough especially many u look nordic model heal
148,easyjet lowcost airline based britain canceled dozen flight experiencing higher usual level emplo
149,join u panel discussion covid ha reshaped fair housing guest speaker includ
150,examining covid vaccine linked potential hearing problem
151,let talk jk recovered covid barely joined boy hobi flew jin
152,ive saying beginning covid dont think exposure level thats great unknown x factor ha yet discovered wish putting effort x factor
153,cdc nih prioritized studying vax complication j peds study found kid pres w myocarditis
154,basically every symptom every illness youve ever heard covid symptomthe hypochondriac love
155,need talk sweden icymi science journal nature ha published scathing assessment swedens pandemic respo
156,working manuscript lancet commission vaccinating prevent longcovid feel though longcovid
157,hmmm maybe china doe crazy merely matter toughing catch covid first place also meaningful goal
158,took shit covid started didnt even make take test mail document
159,news medicare begin cover overthecounter rapid test beneficiary traditional medicar
160,household got absolutely wrecked covid last week stay safe whats worse partner realized hadnt told stay home monday felt something awful coming would gone office covidpositive felt fine
161,basically every symptom every illness youve ever heard covid symptomthe hypochondriac love
162,either healthy economy depends healthy people see
163,sah covid nah catch unnu cyan love street without mi
164,asked board gave qcjo government medium status news org found spreading covid mi
165,family walked city md get covid test uninsured told bill would sent
166,day covid lockdown shanghai today food key thing people mindswe arent allowed leave ho
167,gave widely considered one best performance night muster cov
168,hellothis starship entertainmentwe inform artist monsta x hyungwon ha released quarantine
169,many change behavior seen covid longhaulers also mirror traumatic brain injury incurred
170,need talk sweden icymi science journal nature ha published scathing assessment swedens pandemic respo
171,ominous reading prepare return office certainly catch covid im happy economy though
172,govt ha time meet angandwadi worker protest salary revision served delhi dur
173,covid lockdown tyranny cause mass uprising china week
174,man germany get covid shot sell forged pass
175,cdc covid death inevitable really hurt people medically complex greatmeanwhile
176,suho dont think song suit summerwendy perhaps bc oppas voice warmsuho wendy got clos
177,top form top formi prepared comment wasnt asked said goodi wa waiting like g
178,unvaccinated person doesnt covid ha pcr test travel yet vaccinated person ha covid
179,weve sharing wider symptom covid almost year following science provided
180,people attendance whod recovered covid pointed bts added graphic show v cou
181,neutrality struggle justice evilstraddling two boat end falling
182,full video jungkook going air hanging ceiling hes courageous daring
183,asked around eunbis number wanted lunatic challenge eunbie ah covid let
184,clarification student covid current public messaging covid hooray measure gone reality extremely high incidence rate community mitigation
185,complete breakdown communication gov want pretend covid husband wa eligible pcr test wa told come back next day positive access wa went back filled form waited talked denied
186,periodic reminder congress mandated collection trove data would made much easier
187,let take little journey see great new site work want find testt
188,uk covid public inquiry
189,covid infection everyday ontario lot people going work lot kid going
190,absolute audacity government releasing taxpayer funded medicare ad theyve cutting medicare alm
191,er even though really didnt want go dr told wont let wait outside despite highrisk f
192,wow covid restriction borderthen mask force medical building
193,periodic reminder congress mandated collection trove data would made much easier
194,completes covid quarantine
195,according ha around decade ive new one load time
196,bankruptcy rise coronavirus bailouts phase number company individual declaring bankruptcy rose last year coincided gradual withdrawal statebacked financial support covid
197,know past decade growth interest payment ha outpaced growth export national treasury blame covid risk debt distress insists blame pandemic fiscal indiscipline
198,planned move monthly reporting april im
199,pandemic needled rulebook new proposal waiver covid far useful via
200,urgent know public consultation official uk covid enquiry run end th april
201,ableism normalized society think normal suffer without insurance think normal dismi
202,ppl got clinical assessment centre treatment course hospital government official confirm
203,ba easyjet cancel hundred flight amid covid staff sickness airline industry guardianeasyjet ha cance
204,triple vaccinated ontarians catching covid greater rate double vaccinated vaccinated al
205,husband bald coot ever get covid
206,triple vaccinated ontarians catching covid greater rate double vaccinated vaccinated al
207,minister brexit opportunity refuse apologise describing fluff blaming covid inhumane rul
208,exhausting every disabled person like dont want anyone get long covid people like die thats personal problem
209,weve got covid many year
210,ba easyjet cancel hundred flight amid covid staff sickness airline industry guardianeasyjet ha cance
211,long covid ha ruined life wa got ill im wa sport science major loved powerliftin
212,urgent know public consultation official uk covid enquiry run end th april
213,different disease despite common symptom learn similarity difference two disease
214,urgent know public consultation official uk covid enquiry run end th april
215,one year ago cdc director told got covid shot would neither get spread covid fall
216,wasnt staged really caught card taehyungie hyung threw really really practiced lot
217,working manuscript lancet commission vaccinating prevent longcovid feel though longcovid
218,striking poster american college cardiology conference showing strong association mrna covid vaccine
219,rysei nakao voice frieza ha tested positive covid april rdwishing speedy recovery
220,long covid ha ruined life wa got ill im wa sport science major loved powerliftin
221,dont tell people truth covid people make good judgement risk
222,im confused vaccinated masked people get covid blame people vaccinated
223,covid vaccine unvaccinated aggressively threatened every day year vaccine didnt work
224,chief medical officer health disappear ontarians face new wave covid new wave
225,zero covid doesnt work zero covid inhumane u recorded death china recorded death u population
226,thanks kate really gut u also didnt get covid two year seeing patient office seeing th
227,head ketanji brown jackson wanted empty jail start pandemic every defendant released custody
228,march oan ran halfhour special called story ivermectin effective covid cure isnt keeping guy voiceover slide heres close
229,covid case rising area due ba subvariant cdcs lifting covidrelated border measure expected result surge migrant
230,true creeping secret plan afoot definitely another covid election
231,new analysis oxford university show fraudsters stole around b various covid support scheme double
232,anybody confused beomgyu basically saying think got tested covid already rec
233,back shenzhen back regular covid test next stop wa supposed chongqing look like sc
234,lie perpetrating v coughed somehow related covid dange
235,anyway many major incident come including covid deathimam nasser mohammed alyamanishaban
236,er even though really didnt want go dr told wont let wait outside despite highrisk f
237,neutrality struggle justice evilstraddling two boat end falling
238,kid struggling writing speech development wake covid pandemic uk study find
239,new wave covid coming heres prepare via
240,anyone else still masking handwashing covidfree
241,influential newspaper nation covid death isnt calling national government prepare
242,icymi nh liquor store could sell spirit covid test always opposed legalizing marijuana ha indicated hes open idea
243,oh gotta love wa health   seriously got sorted covid people daughter worse free
244,lie perpetrating v coughed somehow related covid dange
245,new analysis oxford university show fraudsters stole around b various covid support scheme double
246,side effect covid vaccine normal watch animation learn
247,prayer healing pray suffered covid healed
248,feeling brother many treated long covid cormorbidities cov xs leftover used ancestral plant pull u physician open mind ayurvedic medecine
249,hmm im unsure since dont know source yes wasnt tested much maybe understand risk covid pose large allow time number people could die theres also allergy cant really predicted
250,easter getaway havoc heathrow blame passenger level seen since pandemic fewer staff due sickness long queue amid chaos manchester gatwick airport via glad im home
251,reminder governor andrew gillum would turned florida australia far covid regulation go
252,australian utterly disgusted purposely chose show clip like man
253,wow supporting covid vaccine looking polio mmr small pox vaccine instead looking covid vaccine effectiveness havent looked provincial data news article questioning make arrogant misinformed
254,pm narendra modi spoke israel pm naftali bennett confirmed recovering well covid discussed recent global
255,unvaccinated person doesnt covid ha pcr test travel yet vaccinated person ha covid
256,supply shortage global wasnt trumps fault also bidens first year way covid death u ignoring fact bad way try make biden seem competent
257,fda shuts expert authorizing another vaccine boosterdecisions like reinforce perception
258,something celebrate covid mortality reaching historical low globally
259,point doe article consider possibility african government adopted effective covid mitigation pol
260,people attendance whod recovered covid pointed bts added graphic show v cou
261,said postpandemic airport chaos largely due high level staff absence way
262,jungkook prepared little ment top form could say wa good wa listening carefully c
263,next take look jeffrey zients made money becoming covid coordinator tur
264,addendum going add particularly noteworthy information come hand piece contains quote nurs
265,story time last year brother got covid bro wa bad shape ncr hospital full scared
266,urgent know public consultation official uk covid enquiry run end th april
267,covid invention starting feel like making space suit live earth
268,covid number cinema screen south africa isnt going increase anytime soon h
269,people attendance whod recovered covid pointed bts added graphic show v cou
270,almost half billion case covid date wa really wiping tcells many would dropped dead even catching smallest infection already
271,stop using term wave come covid wave never ended stopped reporting number
272,long covid ha ruined life wa got ill im wa sport science major loved powerliftin
273,theres thing wave covid doesnt disappear wait pounce keep culling vulnerab
274,bipartisan senate deal billion covid aid expected announced soon today per multiple source
275,need talk sweden icymi science journal nature ha published scathing assessment swedens pandemic respo
276,jungkook prepared little ment top form could say wa good wa listening carefully c
277,guy look like ftm covid ha never isolated via kochs postulate cytopathic effect occurred vero monkey cell malone provax state ha fully injected covid alternative md shill
278,absolutely poor man home make far accessible year dysautonomia long covid home instruction page long far comprehensive office poor man testing came hopkins via rowes team
279,good morning ive away bit unfortunately caught covid mums funeral week ago
280,easyjet cancel flight staff covidpeople cant get away covid really hasnt gone awaymadnes
281,first covid collective responsibility bend curve together okay actually thats dra
282,long going wear mask ill wear one covid risk subsideit easy take maskit hard
283,covid study published last week journal nature medicine found minuscule amount virus
284,long covid ha ruined life wa got ill im wa sport science major loved powerliftin
285,authority supplier racing secure daily supply resident megacity popul
286,covid lockdown tyranny cause mass uprising china week
287,postcovid navratri teen take spirituality window news
288,back family plural hospitalized covid unit probably due local spike still demoralizing
289,mother four year old leukemia doesnt qualify vaccine could die covid
290,watch police must stand type tyranny covid lockdown brought youtube
291,long covid ha ruined life wa got ill im wa sport science major loved powerliftin
292,im sorry hear lost mom last year th parent th anniversary got depressed lonely lock health deteriorated covid didnt kill mum government restriction
293,risk seriously ill covid far bigger perceived risk vaccine
294,winter omicron surge ha sent kid covid ontario hospital previous pandemic wave
295,majority icu admission vaccinated whats logic blocking canadian traveling get
296,st holiday yr driving avoid covidlate fri eve caught emerging dover crisis get bed amreach f
297,would u get pressed compared timeframe filming bc obviously thats wins series th
